{
  "$schema": "./pointers.schema.json",
  "schema_version": "1.0",
  "requirements": {
    "REQ-001": {"title": "Live BDDK listindeki tüm katılım bankalarını kapsa", "version": "V1", "status": "accepted", "source": "Scenario 2 specification and live BDDK list", "links": ["EVAL-001"]},
    "REQ-002": {"title": "Yalnızca resmî banka web kaynaklarından veri topla", "version": "V1", "status": "accepted", "source": "Scenario 2 specification", "links": ["ADR-002", "EVAL-002"]},
    "REQ-003": {"title": "Türkçe kampanya ve ürün metnini temizle ve ön işle", "version": "V1", "status": "accepted", "source": "Scenario 2 specification", "links": ["ADR-002", "EVAL-003"]},
    "REQ-004": {"title": "Katılım finans terminolojisini bağlama göre yorumla", "version": "V1", "status": "accepted", "source": "Scenario 2 specification; TKBB terminology", "links": ["ADR-003", "EVAL-004"]},
    "REQ-005": {"title": "Banka, oran, tutar, vade, ücret, fayda, geçerlilik, koşul ve müşteri segmentini yapılandır", "version": "V1", "status": "accepted", "source": "Scenario 2 specification", "links": ["ADR-002", "ADR-003", "EVAL-004", "EVAL-005"]},
    "REQ-006": {"title": "Türkçe oran, para, tarih ve vade yazımlarını normalize et", "version": "V1", "status": "accepted", "source": "Scenario 2 specification", "links": ["EVAL-003"]},
    "REQ-007": {"title": "Ürün ve kampanyaları anlamlı sınıflara ayır", "version": "V1", "status": "accepted", "source": "Scenario 2 specification", "links": ["EVAL-006"]},
    "REQ-008": {"title": "Yalnızca karşılaştırılabilir ürünleri açıklanabilir boyutlarda karşılaştır", "version": "V1", "status": "accepted", "source": "Scenario 2 specification", "links": ["ADR-004", "EVAL-007"]},
    "REQ-009": {"title": "Filtreli dashboard ile sonuçları sun", "version": "V1", "status": "accepted", "source": "Scenario 2 specification", "links": ["ADR-001", "EVAL-009"]},
    "REQ-010": {"title": "Kaynak kanıtlı Türkçe chatbot ile sorgulama ve karşılaştırma sun", "version": "V1", "status": "accepted", "source": "Scenario 2 specification", "links": ["ADR-003", "EVAL-008", "EVAL-013"]},
    "REQ-011": {"title": "Dış servise bağımlı olmadan on-premise ve yerel çalış", "version": "V1", "status": "accepted", "source": "Scenario 2 specification scoring criterion", "links": ["ADR-003", "ADR-008", "EVAL-010", "EVAL-011"]},
    "REQ-012": {"title": "Açık kaynak ve ücretsiz bağımlılıklar ile yeniden üretilebilir teslimat sağla", "version": "V1", "status": "accepted", "source": "Scenario 2 specification", "links": ["ADR-005", "EVAL-012"]},
    "REQ-013": {"title": "Kod, türetilmiş veri, dokümantasyon, örnek çıktı, PDF, PPTX ve demo akışını teslim et", "version": "V1", "status": "accepted", "source": "Scenario 2 specification", "links": ["EVAL-014"]},
    "REQ-014": {"title": "Her iddiayı alan düzeyinde kaynak ve dönüşüm kökeniyle izle", "version": "V1", "status": "accepted", "source": "NIST AI 600-1; OWASP AISVS; W3C PROV", "links": ["ADR-002", "EVAL-005"]},
    "REQ-015": {"title": "Güvenilmeyen web içeriğini prompt injection ve uygunsuz çıktı risklerine karşı sınırla", "version": "V1", "status": "accepted", "source": "OWASP LLM01 and AISVS 1.0", "links": ["ADR-003", "EVAL-013"]}
  },
  "enhancements": {
    "ENH-001": {"title": "Yeni veya değişen kampanya için in-app bildirim ve yeniden hesaplama", "version": "V1.1", "status": "accepted", "source": "Team request 2026-07-18", "links": ["ADR-006", "EVAL-015"]},
    "ENH-002": {"title": "Yerel yönetici girişi ve korumalı yönetim işlemleri", "version": "V1.2", "status": "accepted", "source": "Team request 2026-07-18", "links": ["ADR-006", "EVAL-016"]},
    "ENH-003": {"title": "Kurum altyapısına servis olarak eklenebilir sözleşme ve dağıtım sınırı", "version": "V1.3", "status": "accepted", "source": "Team request 2026-07-18", "links": ["ADR-006", "EVAL-017"]}
  },
  "decisions": {
    "ADR-001": {"title": "FastAPI, React ve SQLite tabanlı modüler monolit", "version": "V1", "status": "superseded", "source": "docs/architecture/decisions/ADR-001-modular-monolith.md", "links": ["ADR-008"]},
    "ADR-002": {"title": "Değişmez kaynak artefaktı ve alan düzeyinde kanıt modeli", "version": "V1", "status": "accepted", "source": "docs/architecture/decisions/ADR-002-evidence-first-data.md", "links": ["REQ-002", "REQ-003", "REQ-005", "REQ-014"]},
    "ADR-003": {"title": "Kural öncelikli ve yetkisiz yerel LLM sınırı", "version": "V1", "status": "accepted", "source": "docs/architecture/decisions/ADR-003-local-llm-boundary.md", "links": ["REQ-004", "REQ-005", "REQ-010", "REQ-011", "REQ-015"]},
    "ADR-004": {"title": "Türe ve baza duyarlı saf karşılaştırma motoru", "version": "V1", "status": "accepted", "source": "docs/architecture/decisions/ADR-004-comparison-semantics.md", "links": ["REQ-008"]},
    "ADR-005": {"title": "Ham üçüncü taraf içerik ile açık türetilmiş veriyi ayır", "version": "V1", "status": "accepted", "source": "docs/architecture/decisions/ADR-005-data-and-licensing.md", "links": ["REQ-012"]},
    "ADR-006": {"title": "Enhancementları V1 sonrasında sıralı ve geri uyumlu ekle", "version": "all", "status": "accepted", "source": "docs/architecture/decisions/ADR-006-version-boundaries.md", "links": ["ENH-001", "ENH-002", "ENH-003"]},
    "ADR-007": {"title": "Kubernetes-first değil Kubernetes-compatible dağıtım sınırı", "version": "all", "status": "superseded", "source": "docs/architecture/decisions/ADR-007-deployment-portability.md", "links": ["ADR-008"]},
    "ADR-008": {"title": "Kubernetes ve PostgreSQL birincil V1 platformu", "version": "V1", "status": "accepted", "source": "docs/architecture/decisions/ADR-008-kubernetes-postgresql-baseline.md", "links": ["REQ-009", "REQ-011", "ENH-003", "EVAL-009", "EVAL-010", "EVAL-011", "EVAL-014", "EVAL-017"]},
    "ADR-009": {"title": "Gözlem kimlikli değişiklik tespiti ve uygulama içi bildirim", "version": "V1.1", "status": "accepted", "source": "docs/architecture/decisions/ADR-009-change-detection-and-notifications.md", "links": ["ENH-001", "EVAL-015"]},
    "ADR-010": {"title": "PostgreSQL tabanlı yerel yönetici oturumu", "version": "V1.2", "status": "accepted", "source": "docs/architecture/decisions/ADR-010-local-admin-authentication.md", "links": ["ENH-002", "EVAL-016"]},
    "ADR-011": {"title": "OpenAPI ve CloudEvents tabanlı kurum entegrasyon sınırı", "version": "V1.3", "status": "accepted", "source": "docs/architecture/decisions/ADR-011-institutional-service-boundary.md", "links": ["ENH-003", "EVAL-017"]}
  },
  "evaluations": {
    "EVAL-001": {"title": "On bankanın her biri için başarı veya açık kapsam durumu", "version": "V1", "status": "passed", "source": "docs/evaluation/acceptance-plan.md", "blocking": true},
    "EVAL-002": {"title": "Allowlist, robots, hız sınırı, tekrar deneme ve hash tabanlı toplama testleri", "version": "V1", "status": "proposed", "source": "docs/evaluation/acceptance-plan.md", "blocking": true},
    "EVAL-003": {"title": "Türkçe para, oran, tarih ve vade altın varyant testleri yüzde yüz geçer", "version": "V1", "status": "passed", "source": "docs/evaluation/acceptance-plan.md", "blocking": true},
    "EVAL-004": {"title": "Çekirdek alan macro precision, recall ve F1 en az 0.90", "version": "V1", "status": "proposed", "source": "docs/evaluation/acceptance-plan.md", "blocking": true},
    "EVAL-005": {"title": "Şema geçerliliği ve dolu çekirdek alan kanıtı yüzde yüz; desteksiz iddia sıfır", "version": "V1", "status": "proposed", "source": "docs/evaluation/acceptance-plan.md", "blocking": true},
    "EVAL-006": {"title": "Kampanya sınıflandırma macro-F1 en az 0.90", "version": "V1", "status": "proposed", "source": "docs/evaluation/acceptance-plan.md", "blocking": true},
    "EVAL-007": {"title": "Altın karşılaştırma senaryoları yüzde yüz ve uyumsuz bazlar reddedilir", "version": "V1", "status": "passed", "source": "docs/evaluation/acceptance-plan.md", "blocking": true},
    "EVAL-008": {"title": "Chatbot niyeti, sorgu planı ve citation-ID doğrulaması", "version": "V1", "status": "proposed", "source": "docs/evaluation/acceptance-plan.md", "blocking": true},
    "EVAL-009": {"title": "API sözleşme ve dashboard uçtan uca erişilebilirlik testi", "version": "V1", "status": "proposed", "source": "docs/evaluation/acceptance-plan.md", "blocking": true},
    "EVAL-010": {"title": "Tek düğümlü Kubernetes kümesinde dış ağ ve ücretli servis bağımlılığı olmadan çalışma", "version": "V1", "status": "proposed", "source": "docs/evaluation/acceptance-plan.md", "blocking": true},
    "EVAL-011": {"title": "16 GB CPU laptop Kubernetes profilinde belge p95 hedefi ve kaynak bütçesi ölçülür", "version": "V1", "status": "proposed", "source": "docs/evaluation/acceptance-plan.md", "blocking": false},
    "EVAL-012": {"title": "Bağımlılık, model ve veri lisans envanteri ile SBOM kapısı", "version": "V1", "status": "proposed", "source": "docs/evaluation/acceptance-plan.md", "blocking": true},
    "EVAL-013": {"title": "Sürümlü prompt injection setinde yetki ihlali ve desteklenmeyen iddia sıfır", "version": "V1", "status": "passed", "source": "docs/evaluation/acceptance-plan.md", "blocking": true},
    "EVAL-014": {"title": "Temiz klonda tek komut kurulum, test, örnek veri ve demo materyali", "version": "V1", "status": "proposed", "source": "docs/evaluation/acceptance-plan.md", "blocking": true},
    "EVAL-015": {"title": "İçerik değişikliği tam bir bildirim üretir ve karşılaştırmayı yeniler", "version": "V1.1", "status": "proposed", "source": "docs/evaluation/acceptance-plan.md", "blocking": true},
    "EVAL-016": {"title": "Kimlik doğrulama, oturum, yetki ve brute-force güvenlik testleri", "version": "V1.2", "status": "proposed", "source": "docs/evaluation/acceptance-plan.md", "blocking": true},
    "EVAL-017": {"title": "Container health, OpenAPI uyumu, olay sözleşmesi ve kalıcı veri testi", "version": "V1.3", "status": "proposed", "source": "docs/evaluation/acceptance-plan.md", "blocking": true}
  },
  "work_packages": {